<?xml version="1.0" encoding="UTF-8"?>
<!DOCTYPE branchSecretaries SYSTEM "branchSecretaries.dtd">

<branchSecretaries>
  <branchSecretary>
      <name>
        <firstname>Mary</firstname>
        <lastname>Higgard</lastname>
      </name>
      <email>maryhiggard@asti.ie</email>
      <address isPrivate = 'y'>45 Bulltuggart Road, Louth</address>
      <employedBy>Dublin South Central</employedBy>
    </branchSecretary>
    <branchSecretary>
      <name>
        <firstname>Simon</firstname>
        <lastname>Delaney</lastname>
      </name>
      <email>delsimon@asti.ie</email>
      <address isPrivate = 'y'>125 Church Road, Dublin</address>
      <employedBy>Stillorgan</employedBy>
  </branchSecretary>



</branchSecretaries>